<?xml version="1.0" encoding="UTF-8"?>
<QLBH xmlns:xsi="http://www.w3.org/2001/XMLSchema-instance"
 xsi:noNamespaceSchemaLocation="file:/D:/CongNghe_XML_VaUngDung/QLBH.xsd">
    <MatHang>
        <MaMH>AA00</MaMH>
        <TenMH>TenMH0</TenMH>
        <DonGia>214748364</DonGia>
    </MatHang>
    <MatHang>
        <MaMH>AA00</MaMH>
        <TenMH>TenMH1</TenMH>
        <DonGia>214748364</DonGia>
    </MatHang>
    <HoaDon>
        <MaHD>HD00</MaHD>
        <MaKhachHang>AA00</MaKhachHang>
        <TenKhachHang>TenKhachHang0</TenKhachHang>
        <DiaChi>A</DiaChi>
        <DSMatHangMua>
            <MaMH>:</MaMH>
            <TenMH>TenMH2</TenMH>
            <SoLuong>214748364</SoLuong>
            <DonGia>214748364</DonGia>
        </DSMatHangMua>
    </HoaDon>
    <HoaDon>
        <MaHD>HD00</MaHD>
        <MaKhachHang>AA00</MaKhachHang>
        <TenKhachHang>TenKhachHang1</TenKhachHang>
        <DiaChi>A</DiaChi>
        <DSMatHangMua>
            <MaMH>:</MaMH>
            <TenMH>TenMH3</TenMH>
            <SoLuong>214748364</SoLuong>
            <DonGia>214748364</DonGia>
        </DSMatHangMua>
    </HoaDon>
</QLBH>
